{
  "schema_version": "rarebridge.handoff.v1",
  "sources": {
    "DOI:10.1002/epi.70374": {
      "title": "A prospective natural history study protocol for clinical trial readiness in synaptic disorders",
      "url": "https://doi.org/10.1002/epi.70374",
      "aliases": [
        "PMID:42446932"
      ],
      "published_on": "2026-07-14",
      "source_kind": "human_observational_study",
      "note": "One paper, regardless of the number of claims or identifiers. Source checked for the narrow facts below; applicability still needs scientific review."
    },
    "DOI:10.64898/2026.01.30.26344887": {
      "title": "A Prospective Natural History Study Protocol for Clinical Trial Readiness in Synaptic Disorders (medRxiv preprint v1)",
      "url": "https://www.medrxiv.org/content/10.64898/2026.01.30.26344887v1.full.pdf",
      "aliases": [],
      "published_on": "2026-02-02",
      "source_kind": "preprint",
      "note": "Earlier, not peer-reviewed version of DOI:10.1002/epi.70374. It is the text we could read; the published version was not accessed. It is NOT independent evidence: claims cite the published paper and the review log records that the preprint wording was read. Wording or numbers may differ in the published version.",
      "version_of": "DOI:10.1002/epi.70374"
    },
    "WEB:stxbp1-foundation-starr": {
      "title": "STARR study page, STXBP1 Foundation",
      "url": "https://www.stxbp1disorders.org/starr",
      "aliases": [],
      "published_on": null,
      "source_kind": "organization_webpage",
      "note": "Official STXBP1 Foundation page; undated. Read on 2026-10-04. Current-status statements are only as current as the page."
    },
    "WEB:stxbp1-foundation-home": {
      "title": "STXBP1 Foundation home page",
      "url": "https://www.stxbp1disorders.org/",
      "aliases": [],
      "published_on": null,
      "source_kind": "organization_webpage",
      "note": "Read on 2026-10-04. Lists a 30 Sep 2026 news item on STARR continuing through June 2028; the item itself could not be opened (HTTP 429)."
    },
    "WEB:curesyngap1-prommis-blog": {
      "title": "Four Stories, One Purpose: Our Visits to CHOP (CURE SYNGAP1 blog)",
      "url": "https://curesyngap1.org/blog/four-stories-one-purpose-syngap1-visits-to-chop/",
      "aliases": [],
      "published_on": "2026-03-26",
      "source_kind": "organization_webpage",
      "note": "Official CURE SYNGAP1 blog post describing ProMMiS sites and how families register. Read on 2026-10-04."
    },
    "WEB:curesyngap1-request-nhs-data": {
      "title": "Request Citizen Health Natural History Study (NHS) Data, CURE SYNGAP1",
      "url": "https://curesyngap1.org/request-nhs-data/",
      "aliases": [],
      "published_on": "2023-03-01",
      "source_kind": "organization_webpage",
      "note": "Page metadata says last modified 2025-10-31. Read on 2026-10-04. Describes researcher access to a SYNGAP1 retrospective dataset."
    },
    "WEB:endd-natural-history-study": {
      "title": "Natural History Study, ENDD Center (Penn Medicine / CHOP)",
      "url": "https://endd.med.upenn.edu/research/natural-history-study/",
      "aliases": [],
      "published_on": null,
      "source_kind": "institution_webpage",
      "note": "Study team page for the STXBP1 and SYNGAP1 natural history studies. Read via search snippet on 2026-10-04; full page not opened."
    },
    "WEB:stanford-synaptopathy-research": {
      "title": "Synaptopathy Research and Innovation, Stanford Medicine Children's Health",
      "url": "https://www.stanfordchildrens.org/en/services/synaptopathy/research-innovation.html",
      "aliases": [],
      "published_on": null,
      "source_kind": "institution_webpage",
      "note": "Read via search snippet on 2026-10-04. Spells the SYNGAP1 study 'PRoMiSS'; the paper and CURE SYNGAP1 use 'ProMMiS'."
    },
    "WEB:globalgenes-rarex-stxbp1-2024": {
      "title": "Global Genes and STXBP1 Foundation partnership to use RARE-X for the natural history study (press release)",
      "url": "https://globalgenes.org/press/global-genes-and-stxbp1-foundation-enter-partnership-to-use-rare-x-research-and-data-collection-platform-for-natural-history-study/",
      "aliases": [],
      "published_on": "2024-07-24",
      "source_kind": "press_release",
      "note": "Read via search snippet on 2026-10-04."
    }
  },
  "nodes": [
    {
      "id": "DOI:10.1002/epi.70374",
      "type": "publication",
      "label": "A prospective natural history study protocol for clinical trial readiness in synaptic disorders",
      "url": "https://doi.org/10.1002/epi.70374",
      "aliases": [
        "PMID:42446932"
      ],
      "review_status": "pending"
    },
    {
      "id": "study:starr",
      "type": "study",
      "label": "STARR natural history study (STXBP1-RD)",
      "aliases": [
        "STXBP1 Clinical Trial Ready",
        "STARR"
      ],
      "registry_ids_reported": [
        "NCT06555965"
      ],
      "registry_note": "NCT ID is reported by the STXBP1 Foundation STARR page; the registry record itself was not machine-readable in our check.",
      "review_status": "source_checked"
    },
    {
      "id": "study:prommis",
      "type": "study",
      "label": "ProMMiS natural history study (SYNGAP1-RD)",
      "aliases": [
        "ProMMiS",
        "PRoMiSS"
      ],
      "review_status": "pending"
    },
    {
      "id": "DOI:10.1002/epi.70374#framework",
      "type": "asset",
      "label": "STARR / ProMMiS natural-history framework",
      "asset_type": "published_study_framework",
      "url": "https://doi.org/10.1002/epi.70374",
      "review_status": "pending"
    },
    {
      "id": "asset:seizure-history-reconstruction",
      "type": "asset",
      "label": "Medical-record seizure history reconstruction method",
      "asset_type": "measurement_method",
      "url": "https://doi.org/10.1002/epi.70374",
      "review_status": "source_checked"
    },
    {
      "id": "asset:starr-prommis-qeeg-protocol",
      "type": "asset",
      "label": "Quantitative EEG acquisition protocol (resting state, VEP, AEP)",
      "asset_type": "biomarker_acquisition_protocol",
      "url": "https://doi.org/10.1002/epi.70374",
      "review_status": "source_checked"
    },
    {
      "id": "asset:curesyngap1-citizen-nhs-dataset",
      "type": "asset",
      "label": "SYNGAP1 retrospective medical-record dataset (Citizen Health, via CURE SYNGAP1)",
      "asset_type": "dataset",
      "url": "https://curesyngap1.org/request-nhs-data/",
      "review_status": "pending"
    },
    {
      "id": "asset:simons-searchlight-prom-data",
      "type": "asset",
      "label": "Simons Searchlight retrospective caregiver-reported data (STXBP1, SYNGAP1)",
      "asset_type": "registry_dataset",
      "url": "https://doi.org/10.1002/epi.70374",
      "review_status": "source_checked"
    },
    {
      "id": "asset:rare-x-prom-collection",
      "type": "asset",
      "label": "RARE-X caregiver-reported outcome collection (used by STARR/ProMMiS)",
      "asset_type": "data_collection_platform",
      "url": "https://doi.org/10.1002/epi.70374",
      "review_status": "pending"
    },
    {
      "id": "org:stxbp1-foundation",
      "type": "organization",
      "label": "STXBP1 Foundation",
      "url": "https://www.stxbp1disorders.org/starr",
      "review_status": "source_checked"
    },
    {
      "id": "org:cure-syngap1",
      "type": "organization",
      "label": "CURE SYNGAP1",
      "url": "https://curesyngap1.org/contact/",
      "review_status": "source_checked"
    },
    {
      "id": "team:chop-endd-nhs",
      "type": "study_team",
      "label": "CHOP / Penn ENDD natural history study team",
      "url": "https://endd.med.upenn.edu/research/natural-history-study/",
      "review_status": "pending"
    },
    {
      "id": "researcher:ingo-helbig",
      "type": "researcher",
      "label": "Ingo Helbig, MD",
      "url": "https://www.stxbp1disorders.org/starr",
      "review_status": "pending"
    },
    {
      "id": "researcher:jillian-mckee",
      "type": "researcher",
      "label": "Jillian L. McKee, MD, PhD",
      "url": "https://doi.org/10.1002/epi.70374",
      "review_status": "pending"
    },
    {
      "id": "team:stanford-synaptopathy",
      "type": "study_team",
      "label": "Stanford Medicine Children's Health synaptopathy team",
      "url": "https://www.stanfordchildrens.org/en/services/synaptopathy/research-innovation.html",
      "review_status": "pending"
    }
  ],
  "edges": [
    {
      "id": "edge:overlay:paper-describes-starr",
      "source": "DOI:10.1002/epi.70374",
      "target": "study:starr",
      "relation": "describes_study",
      "provenance": {
        "source_url": "https://doi.org/10.1002/epi.70374",
        "retrieved_on": "2026-10-04",
        "curation_lane": "curation/build_overlay.py"
      },
      "review_status": "pending",
      "source_ids": [
        "DOI:10.1002/epi.70374"
      ],
      "confidence_label": "Unassessed — source review pending",
      "explanation": "The paper describes the STARR protocol for STXBP1-RD (Methods, Study Organization & Management).",
      "claim_origin": "recorded"
    },
    {
      "id": "edge:overlay:paper-describes-prommis",
      "source": "DOI:10.1002/epi.70374",
      "target": "study:prommis",
      "relation": "describes_study",
      "provenance": {
        "source_url": "https://doi.org/10.1002/epi.70374",
        "retrieved_on": "2026-10-04",
        "curation_lane": "curation/build_overlay.py"
      },
      "review_status": "pending",
      "source_ids": [
        "DOI:10.1002/epi.70374"
      ],
      "confidence_label": "Unassessed — source review pending",
      "explanation": "The paper describes the ProMMiS protocol for SYNGAP1-RD (Methods, Study Organization & Management).",
      "claim_origin": "recorded"
    },
    {
      "id": "edge:overlay:stxbp1-studied-in-starr",
      "source": "MONDO:0012812",